title,image_url,course_link,description
Data Science Career Conclave,https://import.cdn.thinkific.com/118220/courses/1230486/udv57o17QrG3uuBO8BwD_1200x628-icon.png,https://courses.analyticsvidhya.com/courses/data-science-career-conclave,"It feels like half the world wants to move into data science these days, with spectacular perks and a plethora of openings on offer in the industry. Organizations are investing heavily in data science talent to stay or move ahead of their competitors. As a data science aspirant, you couldn’t have picked a better time to change your career!"
Top Data Science Projects for Analysts and Data Scientists,https://import.cdn.thinkific.com/118220/oNPtWVT9CbWwip5Ogang_project_thumb.jpg,https://courses.analyticsvidhya.com/courses/top-data-science-projects-for-analysts-and-data-scientists,This is a very common question interviewers ask in data science interviews. We have conducted hundreds of these interviews for both data analyst and data scientist roles and this is quite often the jackpot question. This is especially true if you’re a fresher or a relative newcomer to data science.
Getting Started with Git and GitHub for Data Science Professionals,https://import.cdn.thinkific.com/118220/pbMFVOw2RPi9fFXSOuGP_github_thumb.jpg,https://courses.analyticsvidhya.com/courses/getting-started-with-git-and-github-for-data-science-professionals,Ever heard of version control? It is one of the most important concepts in a data scientist’s daily role - and yet most newcomers and beginners haven’t even come across it! This is a fallacy you must overcome as soon as possible.
Machine Learning Starter Program,https://import.cdn.thinkific.com/118220/OTJAEtMGQWaxxIWD0pWv_MLSP%20thumb.jpg,https://courses.analyticsvidhya.com/bundles/machine-learning-starter-program,We generate more than 2.5 quintillion bytes of data every day - and companies across the globe are hiring data scientists to make sense of this data.
"Data Science Hacks, Tips and Tricks",https://import.cdn.thinkific.com/118220/qaomVKyQPaj9MCRxO9dg_course%20thumb%20image.jpg,https://courses.analyticsvidhya.com/courses/data-science-hacks-tips-and-tricks,"The Data Science Hacks, Tips and Tricks course is your one stop destination to become a better and more efficient data scientist!"
Introduction to Business Analytics,https://import.cdn.thinkific.com/118220/uQspaf6ESc6KPX6jkVrx_Introduction_to_Business_Analytics_fcacd85c-25ff-44bf-a74d-ee3aa66e51d4.png,https://courses.analyticsvidhya.com/courses/introduction-to-analytics,Getting Started with Business Analytics
Introduction to PyTorch for Deep Learning,https://import.cdn.thinkific.com/118220/3Ec7NO7MTkqaEImQio94_pytorch_thumb.jpg,https://courses.analyticsvidhya.com/courses/introduction-to-pytorch-for-deeplearning,Welcome to the world of PyTorch - a deep learning framework that has changed and re-imagined the way we build deep learning models.
Introductory Data Science for Business Managers,https://import.cdn.thinkific.com/118220/oF8KoXuyQ7KrHIRMmTt5_Business_Manager.jpg,https://courses.analyticsvidhya.com/bundles/introductory-data-science-for-business-managers,The data science revolution is well and truly disrupting multiple and diverse industries. It has become the centerpiece of strategic decision making for organizations. Are you prepared to enable it for your business and your current role?
Introduction to Natural Language Processing,https://import.cdn.thinkific.com/118220/X8bM7n4REC8ykgf53oSj_10.Introduction%20to%20AI%20_%20ML.png,https://courses.analyticsvidhya.com/courses/Intro-to-NLP,"Natural Language Processing is the art of extracting information from unstructured text. Learn basics of Natural Language Processing, Regular Expressions & text sentiment analysis using machine learning in this course."
Getting started with Decision Trees,https://import.cdn.thinkific.com/118220/Tgfv1fveTpWrv3ZFTt6r_Decision_Trees_ca3c729e-525b-4c8c-9f48-dec4bbb4faf3.png,https://courses.analyticsvidhya.com/courses/getting-started-with-decision-trees,"A Decision Tree is a flowchart like structure, where each node represents a decision, each branch represents an outcome of the decision, and each terminal node provides a prediction / label."
Introduction to Python,https://import.cdn.thinkific.com/118220/QAUsjF0qSxCI7fsIrzhn_Algorithm_in_Python_and_R_1b947457-056e-4bfb-9a6f-ce614ebfe3c4.png,https://courses.analyticsvidhya.com/courses/introduction-to-data-science,Do you want to enter the field of Data Science? Are you intimidated by the coding you would need to learn? Are you looking to learn Python to switch to a data science career?
Loan Prediction Practice Problem (Using Python),https://import.cdn.thinkific.com/118220/pcauZ3ZqSWqrYXlYTd0w_Loan_Prediction_Practice_Problem_8dbf2aea-f3c8-42d4-bd27-87e738de5aac.png,https://courses.analyticsvidhya.com/courses/loan-prediction-practice-problem-using-python,This course is designed for people who want to solve binary classification problems. Classification is a skill every Data Scientist should be well versed in.
Big Mart Sales Prediction Using R,https://import.cdn.thinkific.com/118220/t1hnCAcdT22pr7EEWQpW_Sales%20Prediction_thumb.jpg,https://courses.analyticsvidhya.com/courses/big-mart-sales-prediction-using-r,"Sales prediction is a very common real life problem that each company faces at least once in its life time. If done correctly, it can have a significant impact on the success and performance of that company."
Twitter Sentiment Analysis,https://import.cdn.thinkific.com/118220/nwZ67Ta2R0SO6uI4mWBe_Twitter%20Sentiment%20Analysis.jpg,https://courses.analyticsvidhya.com/courses/twitter-sentiment-analysis,
Pandas for Data Analysis in Python,https://import.cdn.thinkific.com/118220/SPL9Cu7sQ5uihQ2mGYtO_Pandas_for_Data_Analysis_in_Python_7760df6c-f648-46d8-93f3-ba4e49d89a22.png,https://courses.analyticsvidhya.com/courses/pandas-for-data-analysis-in-python,"Pandas is one of the most popular Python libraries in data science. In fact, Pandas is among those elite libraries that draw instant recognition from programmers of all backgrounds, from developers to data scientists."
Support Vector Machine (SVM) in Python and R,https://import.cdn.thinkific.com/118220/PhPoLyt7QKOucBS6VLf2_Support%20Vector%20Machine_thumb.jpg,https://courses.analyticsvidhya.com/courses/support-vector-machine-svm-in-python-and-r,Want to learn the popular machine learning algorithm - Support Vector Machines (SVM)? Support Vector Machines can be used to build both Regression and Classification Machine Learning models.
Evaluation Metrics for Machine Learning Models,https://import.cdn.thinkific.com/118220/Qb1PlcDoTEeoR1ZOOvUy_evaluation%20metrics_thumb.jpg,https://courses.analyticsvidhya.com/courses/evaluation-metrics-for-machine-learning-models,"Evaluation metrics form the backbone of improving your machine learning model. Without these evaluation metrics, we would be lost in a sea of machine learning model scores - unable to understand which model is performing well."
Fundamentals of Regression Analysis,https://import.cdn.thinkific.com/118220/C5HN5LVDQsyS1hRojIyT_courses_thumb.jpg,https://courses.analyticsvidhya.com/courses/Fundamentals-of-Regression-Analysis,"Linear regression and logistic regression are typically the first algorithms we learn in data science. These are two key concepts not just in machine learning, but in statistics as well."
Getting Started with scikit-learn (sklearn) for Machine Learning,https://import.cdn.thinkific.com/118220/d8R1MoSmisGRZk4UJWQF_thumb_.jpg,https://courses.analyticsvidhya.com/courses/get-started-with-scikit-learn-sklearn,"Scikit-learn, or sklearn for short, is the first Python library we turn to when building machine learning models. Sklearn is unanimously the favorite Python library among data scientists. As a newcomer to machine learning, you should be comfortable with sklearn and how to build ML models, including:"
Convolutional Neural Networks (CNN) from Scratch ,https://import.cdn.thinkific.com/118220/4yxTr5xuQy6snBYBcHP8_Convolutional%20Neural%20Networks_thumb.jpg,https://courses.analyticsvidhya.com/courses/convolutional-neural-networks-cnn-from-scratch,"Convolutional Neural Networks, or CNN as they’re popularly called, are the go-to deep learning architecture for computer vision tasks, such as object detection, image segmentation, facial recognition, among others. CNNs have even been extended to the field of video analysis!"
Dimensionality Reduction for Machine Learning,https://import.cdn.thinkific.com/118220/Um1x4Xh7RIGzMIQuwCeM_course_thumb%20.jpg,https://courses.analyticsvidhya.com/courses/dimensionality-reduction-for-machine-learning,"Have you worked on a dataset with more than a thousand features? How about 40,000 features? We are generating data at an unprecedented pace right now and working with massive datasets in machine learning projects is becoming mainstream."
K-Nearest Neighbors (KNN) Algorithm in Python and R,https://import.cdn.thinkific.com/118220/7FpGUA1gQLWbDB5oVsCz_thumb_.jpg,https://courses.analyticsvidhya.com/courses/K-Nearest-Neighbors-KNN-Algorithm,"K-Nearest Neighbor (KNN) is one of the most popular machine learning algorithms. As a newcomer or beginner in machine learning, you’ll find KNN to be among the easiest algorithms to pick up."
Ensemble Learning and Ensemble Learning Techniques,https://import.cdn.thinkific.com/118220/doHSugITVCfoBUVdlxeH_Ensemble%20Learning-thumb.jpg,https://courses.analyticsvidhya.com/courses/ensemble-learning-and-ensemble-learning-techniques,"Ensemble learning is a powerful machine learning algorithm that is used across industries by data science experts. The beauty of ensemble learning techniques is that they combine the predictions of multiple machine learning models. You must have used or come across several of these ensemble learning techniques in your machine learning journey:- Bagging- Boosting- Stacking- Blending, etc. These ensemble learning techniques include popular machine learning algorithms such as XGBoost, Gradient Boosting, among others. You must be getting a good idea of how vast and useful ensemble learning can be!"
Linear Programming for Data Science Professionals,https://import.cdn.thinkific.com/118220/TMBNBD4R5a1YdlMHJada_thumb.jpg,https://courses.analyticsvidhya.com/courses/linear-programming,Optimization is the way of life. We all have finite resources and time and we want to make the most of them. From using your time productively to solving supply chain problems for your company – everything uses optimization.
Naive Bayes from Scratch,https://import.cdn.thinkific.com/118220/tdU7ioeOQG4ZuHzhoJrQ_thumb_.jpg,https://courses.analyticsvidhya.com/courses/naive-bayes,Naive Bayes ranks in the top echelons of the machine learning algorithms pantheon. It is a popular and widely used machine learning algorithm and is often the go-to technique when dealing with classification problems.
Learn Swift for Data Science,https://import.cdn.thinkific.com/118220/QT5BeWvTG2ITfNiyiCZQ_thumb.jpg,https://courses.analyticsvidhya.com/courses/learn-swift-for-data-science,"he Swift programming language is quickly becoming the language of choice for a lot of data science experts and professionals. Swift’s flexibility, ease of use, excellent documentation, and quick execution speed are key reasons behind the language’s recent prominence in the data science space."
