title,image_url,course_link,description
Frameworks for Effective Problem Solving,https://import.cdn.thinkific.com/118220/zdlLMkFXQjuKiItB273o_Thumbnail%201.jpg,https://courses.analyticsvidhya.com/courses/frameworks-for-effective-problem-solving,"Master the art of structured thinking to tackle complex challenges effectively. This course covers essential frameworks like SMART, MECE, and Issue Trees, guiding you in defining and solving problem statements while avoiding common pitfalls. Learn practical, step-by-step methods to enhance decision-making and problem-solving skills."
Anyone can Build AI Agents - Free Course,https://import.cdn.thinkific.com/118220/HDiuucWOTp2G0PDvjEQm_build%20your%20first%20agent%20using%20no%20code%20tools%20(1).jpg,https://courses.analyticsvidhya.com/courses/your-ultimate-guide-to-becoming-an-agentic-ai-expert-by-2025,
A Comprehensive Learning Path to Become a Data Analyst in 2025,https://import.cdn.thinkific.com/118220/qdmHBCw7Qtqw2Y9g0vOE_Become%20a%20GenAI%20Expert%20in%202025.%20Thumbnail.jpg,https://courses.analyticsvidhya.com/courses/a-comprehensive-learning-path-to-become-a-data-analyst-in-2025,Where do I begin? Data Analyst is such a huge field - where do you even start learning about Data Analyst?
Reimagining GenAI: Common Mistakes and Best Practices for Success,https://import.cdn.thinkific.com/118220/ky8mTd5ISIypAcrVJkdO_unnamed%20(4).jpg,https://courses.analyticsvidhya.com/courses/reimagining-genai-common-mistakes-and-best-practices-for-success,"Generative AI is transforming industries, but implementation challenges often hinder its success. This course, led by experienced GenAI expert Shabazz Mohammed, dives deep into the pitfalls of adopting generative AI and provides actionable best practices to overcome them."
Coding a ChatGPT-style Language Model from Scratch in PyTorch,https://import.cdn.thinkific.com/118220/Q1tYD2LSlaLzL1XPZWgw_1Mastering%20Multilingual%20GenAI%20Open-Weights%20for%20Indic%20Languages%20copy.png,https://courses.analyticsvidhya.com/courses/coding-a-chatgpt-style-language-model-from-scratch-in-pytorch,"Master the art of building a ChatGPT-style language model from scratch with PyTorch. In this course, you'll explore essential NLP concepts, implement transformers, and create a decoder-only architecture step-by-step. Guided by expert tutorials, gain practical skills to develop advanced AI models tailored for real-world applications."
Mastering Multilingual GenAI Open-Weights for Indic Languages,https://import.cdn.thinkific.com/118220/beC0zMfQhOnHcT2FLR4g_unnamed%20(2).jpg,https://courses.analyticsvidhya.com/courses/mastering-multilingual-genai-open-weights-for-indic-languages,"Mastering Multilingual GenAI – Open-Weights for Indic Languages"" is a course designed to equip you with the knowledge to develop state-of-the-art multilingual AI models using open-weight architectures. Focusing on low-resource languages, particularly Indic languages, the course covers essential topics like multilingual AI training, instruction fine-tuning, model building, and performance evaluation."
Learning Autonomous Driving Behaviors with LLMs & RL ,https://import.cdn.thinkific.com/118220/lrzfD3upSjb0iUOrJcOo_unnamed%20(1).jpg,https://courses.analyticsvidhya.com/courses/learning-autonomous-driving-behaviors-with-llms-and-rl,"This course dives into the development of autonomous driving behaviors using Reinforcement Learning (RL) and Large Language Models (LLMs). You’ll explore how RL agents are trained to navigate complex, real-world environments while making safe, human-like driving decisions. The course tackles key challenges such as designing effective reward systems, ensuring safety in high-speed driving scenarios, and improving the interpretability of AI decisions. Through practical projects, you will design RL agents using techniques like Deep Q-Networks (DQN), experience replay, and integrate LLMs to enhance decision-making."
GenAI Applied to Quantitative Finance: For Control Implementation,https://import.cdn.thinkific.com/118220/0hkgoKCKTnKKxhQGAEIp_govind_av_httpss.mj.runER3kgo8rubs_based_on_this_theme_create_b2190701-9e82-47ea-b65a-c52d6de94e07_3.png,https://courses.analyticsvidhya.com/courses/genai-applied-to-quantitative-finance-for-control-implementation,"This course explores the application of Generative AI in quantitative finance, focusing on building sustainable trading algorithms through keyword extraction, sentiment analysis, and time-series forecasting. Learn to predict commodity prices, such as gold, by integrating data from financial news sources, leveraging sentiment analysis, and optimizing models for robust trading signals."
"Navigating LLM Tradeoffs: Techniques for Speed, Cost, Scale & Accuracy",https://import.cdn.thinkific.com/118220/SV5jeKd1Q4iFyzMlUSdw_Thumbnail.png,https://courses.analyticsvidhya.com/courses/navigating-llm-tradeoffs-techniques-for-speed-cost-scale-and-accuracy,"This course provides a concise guide to optimizing Large Language Models (LLMs) by navigating tradeoffs in speed, cost, scale, and accuracy. Learn practical techniques like LoRA, model quantization, and parameter-efficient fine-tuning to improve performance while reducing costs. You'll explore various deployment strategies and understand how to evaluate LLMs using industry-standard benchmarks, making this course ideal for anyone seeking efficient, scalable AI solutions."
Creating Problem-Solving Agents using GenAI for Action Composition,https://import.cdn.thinkific.com/118220/ih6JsBMgSCWbl9ofgpYg_Thumbnail%20.png,https://courses.analyticsvidhya.com/courses/creating-problem-solving-agents-using-genai-for-action-composition,"This introductory course provides a concise overview of Agentic AI systems, covering their evolution, current state, and practical applications. You will explore key topics including the history of Agentic AI systems, the role of agents today, multi-agent systems, and practical solutions for implementing them. Perfect for those seeking a foundational understanding of intelligent Agentic AI systems in action."
Improving Real World RAG Systems: Key Challenges & Practical Solutions,https://import.cdn.thinkific.com/118220/70WfAJhFRsyXXdLQcWIl_281762.jpg,https://courses.analyticsvidhya.com/courses/improving-real-world-rag-systems-key-challenges,"This course explores the key challenges in building real-world Retrieval-Augmented Generation (RAG) systems and provides practical solutions. Topics include improving data retrieval, dealing with hallucinations, context selection, and optimizing system performance using advanced prompting, retrieval strategies, and evaluation techniques. Through hands-on demos, you will gain insights into better chunking, embedding models, and agentic RAG systems for more robust, real-world applications."
Framework to Choose the Right LLM for your Business,https://import.cdn.thinkific.com/118220/A3lVcQcRRbKN9IBZANvV_cinematic-person-is-looking-customer-journey-map%201.jpg,https://courses.analyticsvidhya.com/courses/choosing-the-right-LLM-for-your-business,"This course will guide you through the process of selecting the most suitable Large Language Model (LLM) for various business needs. By examining factors such as accuracy, cost, scalability, and integration, you will understand how different LLMs perform in specific scenarios, from customer support to healthcare and strategy development. The course emphasizes practical decision-making with real-world case studies, helping businesses navigate the rapidly evolving LLM landscape effectively."
Building Smarter LLMs with Mamba and State Space Model,https://import.cdn.thinkific.com/118220/FbdKUqgKSj2K80QgVl1z_THUMBNAIL%20(1).png,https://courses.analyticsvidhya.com/courses/building-smarter-llms-with-mamba-and-state-space-model,"Unlock the Power of State Space Models (SSM) like Mamba with our comprehensive course designed for AI professionals, data scientists, and NLP enthusiasts. Master the art of integrating SSM with deep learning, unravel the complexities of models like Mamba, and elevate your understanding of Generative AI's newest and most innovative models. This course is designed to equip you with the skills needed to understand these cutting-edge AI models and how they work, making you proficient in the latest AI techniques and architectures."
Generative AI - A Way of Life - Free Course,https://import.cdn.thinkific.com/118220/0hkgoKCKTnKKxhQGAEIp_govind_av_httpss.mj.runER3kgo8rubs_based_on_this_theme_create_b2190701-9e82-47ea-b65a-c52d6de94e07_3.png,https://courses.analyticsvidhya.com/courses/genai-a-way-of-life,"This course is a transformative journey tailored for beginners and delves into AI-powered text and image generation using leading tools like ChatGPT, Microsoft Copilot, and DALL·E3. Learn practical applications across industries, ethical considerations, and best practices. Whether you're a content creator, business innovator, or AI enthusiast, gain the expertise to harness Generative AI's full potential and drive innovation in your field."
Building LLM Applications using Prompt Engineering - Free Course,https://import.cdn.thinkific.com/118220/GnpgN0uiTA1VO2MpQvTA_3.png,https://courses.analyticsvidhya.com/courses/building-llm-applications-using-prompt-engineering-free,"This course will provide you with a hands-on understanding of building LLM applications and mastering prompt engineering techniques. By the end of the course, you will be proficient in implementing and fine-tuning these techniques to enhance generative AI model performance. You'll learn to apply various prompting methods and build chatbots on enterprise data, equipping you with the skills to improve conversational AI systems in real-world projects."
Building Your First Computer Vision Model - Free Course,https://import.cdn.thinkific.com/118220/cv8WEAZPRtGcSR8A2kBY_cv%20thumbnail.png,https://courses.analyticsvidhya.com/courses/building-your-first-computer-vision-model,"This course will help you gain a deep understanding of Computer Vision and build advanced CV models using the PyTorch framework. With a carefully curated list of resources and exercises, this course is your guide to becoming a Computer Vision expert. Master the techniques to build convolutional neural networks, and classify images."
Bagging and Boosting ML Algorithms - Free Course,https://import.cdn.thinkific.com/118220/ZPH29GMrTey5gAaobwAH_Getting%20started%20with%20Decision%20Trees.jpg,https://courses.analyticsvidhya.com/courses/bagging-boosting-ML-Algorithms,"This course will provide you with a hands-on understanding of Bagging and Boosting techniques in machine learning. By the end of the course, you will be proficient in implementing and tuning these ensemble methods to enhance model performance. You'll learn to apply algorithms like Random Forest, AdaBoost, and Gradient Boosting to a real-world dataset, equipping you with the skills to improve predictive accuracy and robustness in your projects."
MidJourney: From Inspiration to Implementation - Free Course,https://import.cdn.thinkific.com/118220/NclAzDSwRwedON784y83_QZQvFaQFTFu4cFHZ0O5A_Midjourney%20(1).png,https://courses.analyticsvidhya.com/courses/midjourney_from_inspiration_to_implementation,"This course will provide you with a practical understanding of MidJourney tools. By the end of the course, you will be able to utilize MidJourney effectively and explore alternative tools for your creative projects. You'll learn how to draw inspiration, use MidJourney's features, and understand its applications through engaging lessons."
Understanding Linear Regression - Free Course,https://import.cdn.thinkific.com/118220/vK6lGCCqSsWtESgG69K1_Foundational%20ML%20Algorithms.png,https://courses.analyticsvidhya.com/courses/free-understanding-linear-regression,"This free course will help you understand the fundamentals of linear regression in a straightforward manner. By the end of this course, you will be able to build predictive models using linear regression techniques. With a carefully curated list of resources and exercises, this course serves as your comprehensive guide to mastering linear regression."
The Working of Neural Networks - Free Course,https://import.cdn.thinkific.com/118220/cu3qVXYTR7WEDj7eYQXS_unnamed.jpg,https://courses.analyticsvidhya.com/courses/the-working-of-neural-networks,"This free course will help you understand the end-to-end working of neural networks in a simple manner. By the end of this course, you will be able to build advanced Deep Learning models using the PyTorch framework. With a carefully curated list of resources and exercises, this course serves as your comprehensive guide to mastering deep learning. It is recommended that you complete the advanced Machine Learning course before taking up this course."
The A to Z of Unsupervised ML - Free Course,https://import.cdn.thinkific.com/118220/a8FaIfN8SyfgOEhgzcHx_Getting_Started_with_Neural_Networks_307d8d11-d90e-45eb-8885-7d8f59fadc48.png,https://courses.analyticsvidhya.com/courses/free-unsupervised-ml-guide,"Unsupervised machine learning helps uncover hidden patterns and structures in data without labeled examples. It is essential for exploratory data analysis, reducing dimensionality, and discovering intrinsic relationships within datasets. Mastering unsupervised techniques enhances data preprocessing and drives insights in complex datasets where labels are scarce or unavailable."
Building Your first RAG System using LlamaIndex - Free Course,https://import.cdn.thinkific.com/118220/HSr06pXxRTeF2Lpp6VQl_DALL%C2%B7E%202024-07-03%2011.42.42%20-%20A%20visually%20striking%20representation%20of%20a%20Retrieval-Augmented%20Generation%20(RAG)%20system%20using%20LlamaIndex.%20The%20image%20should%20have%20a%20dark%20background%20with%20int.png,https://courses.analyticsvidhya.com/courses/building-first-rag-systems-using-llamaindex,"This course will guide you through building your first Retrieval-Augmented Generation (RAG) system using LlamaIndex. You will start with data ingestion by loading a file into the system, followed by indexing the data for efficient retrieval. Next, you will set up retrieval configurations and use a response synthesizer to combine data into a coherent response. Finally, you will employ a query engine to generate responses. By the end of this course, you will have a solid understanding of these processes and be able to build an RAG system using LlamaIndex code effectively."
Data Preprocessing on a Real-World Problem Statement - Free Course,https://import.cdn.thinkific.com/118220/2BmYWOASeye7uIgp3mHr_Building%20your%20first%20ML%20model.png,https://courses.analyticsvidhya.com/courses/data-preprocessing,"This course will help you get a practical understanding of Data Preprocessing. After this course, you can work on any data and prepare it for modelling. With a carefully curated list of resources, this course is your first step to becoming a Data Scientist. By the end of the course, you will have mastered techniques like EDA and Missing Value Treatment."
Exploring Stability.AI - Free Course,https://import.cdn.thinkific.com/118220/imiRzsUqTwuQxv4wfyUb_mastering-stable-diffusion-thumbnail_2.png,https://courses.analyticsvidhya.com/courses/exploring-stability-ai,"This course will give you a practical understanding of Stability.AI tools. By the end of the course, you will be able to deploy and customize SD WebUI, and use the Automatic1111 WebUI on RunPod GPU environments. You'll learn to install, set up, generate, and fine-tune SD WebUI settings, equipping you with the skills to harness Stability.AI's full potential for your projects."
Building a Text Classification Model with Natural Language Processing - Free Course,https://import.cdn.thinkific.com/118220/YfA6OJ6ATeiwbbvvzb5h_NLP%20Banner.png,https://courses.analyticsvidhya.com/courses/free-building-textclassification-natural-language-processing,"Gain practical insights into Natural Language Processing (NLP) with our comprehensive course. Learn to build NLP models using PyTorch, delve into classification models, and apply techniques like bag-of-words, count vectorizer and so on. Perfect for professionals seeking to enhance their skills and aspiring students entering the tech industry."
Getting Started with Large Language Models,https://import.cdn.thinkific.com/118220/TwSmk34ARlGMcQu4M8Co_A_Comprehensive_Learning_Path_to_Become_a_Data_Sc_265db306-1f93-496d-827e-0f1e534c9cf1.png,https://courses.analyticsvidhya.com/courses/getting-started-with-llms,"This course will help you gain a comprehensive understanding of Large Language Models (LLMs) and develop advanced natural language processing (NLP) applications using the PyTorch framework. With a carefully curated list of resources and exercises, this course is your guide to becoming an expert in LLMs. Master the techniques to build and fine-tune LLMs, and generate human-like text."
Introduction to Generative  AI,https://import.cdn.thinkific.com/118220/CNjAWH6TUaIQt8N5FX9Y_thumbnail%201.png,https://courses.analyticsvidhya.com/courses/introduction-to-generative-ai,"This course will provide you with a comprehensive understanding of generative AI, including text and image generation techniques. By the end of the course, you will be have an understanding of using generative AI tools to create diverse content. You'll learn how generative AI works, engage in practical exercises, and gain the skills to implement these techniques in real-world projects."
Exploring Natural Language Processing (NLP) using Deep Learning,https://import.cdn.thinkific.com/118220/vl3JHf3eS0Wp9XPLeDaL_8.png,https://courses.analyticsvidhya.com/courses/exploring-natural-language-processing-nlp-using-deep-learning,Natural Language Processing (NLP) is the hottest field in the data science space right now. The demand for NLP experts and data scientists is through the roof.
Getting Started with Deep Learning,https://import.cdn.thinkific.com/118220/KybSy5ROKQAC4fyxyFlQ_6_.png,https://courses.analyticsvidhya.com/courses/getting-started-with-deep-learning,Deep learning algorithms are revolutionizing data science industry and disrupting several domains. From computer vision applications to natural language processing (NLP) use cases - every field is benefitting from use of Deep Learning models.
Nano Course: Dreambooth-Stable Diffusion for Custom Images,https://import.cdn.thinkific.com/118220/sU6NzHaSiCPghfiOpQ52_Introduction_to_Natural_Language_Processing_b92e8456-3145-489b-97e7-51925a655b2c.png,https://courses.analyticsvidhya.com/courses/nano-course-dreambooth-stable-diffusion-for-custom-images,Have you ever wondered how to turn your dreams into reality by creating images of your dog traveling around the world or yourself alongside Elon Musk or playing cricket with MSD?
A Comprehensive Learning Path for Deep Learning in 2023,https://files.cdn.thinkific.com/courses/course_card_image_000/580/9901576591074.original.jpg,https://courses.analyticsvidhya.com/courses/a-comprehensive-learning-path-for-deep-learning-in-2023,The most common question we get from beginners in the field of Deep Learning is - Where to begin? The journey to becoming a Deep Learning expert can be difficult if one does not have the right resources to follow. There are a million resources to refer and it is tough to decide where to start from.
A Comprehensive Learning Path to Become a Data Scientist in 2024,https://import.cdn.thinkific.com/118220/1b0s4lDiQluveqaLqKj8_A_Comprehensive_Learning_Path_to_Become_a_Data_Sc_6e902c6d-46bf-4b8b-91cc-24329e68086c.png,https://courses.analyticsvidhya.com/courses/a-comprehensive-learning-path-to-become-a-data-scientist-in-twenty-twenty-four,Where do I begin? Data science is such a huge field - where do you even start learning about Data Science?
Nano Course: Building Large Language Models for Code,https://import.cdn.thinkific.com/118220/OelAeGXrRuGrnkcJSdAO_OG.png,https://courses.analyticsvidhya.com/courses/building-large-language-models-for-code,"In this Free Nano GenAI Course on Building Large Language Models for Code, you will-"
Nano Course: Cutting Edge LLM Tricks,https://import.cdn.thinkific.com/118220/OelAeGXrRuGrnkcJSdAO_OG.png,https://courses.analyticsvidhya.com/courses/cutting-edge-llm-tricks,"In this free nano GenAI course on Cutting Edge LLM Tricks, you will-"
Certified AI & ML BlackBelt+ Program,https://files.cdn.thinkific.com/bundles/bundle_card_image_000/048/808/1719037298.original.png,https://courses.analyticsvidhya.com/bundles/certified-ai-ml-blackbelt-plus,"What happens when you combine ALL of Analytics Vidhya’s comprehensive courses, curated and designed by instructors with decades of data science experience? You get the AI & ML BlackBelt+ program!"
Machine Learning Summer Training,https://import.cdn.thinkific.com/118220/courses/1903742/zJ10PGDvQPKiGRGM73Dn_icon%282%29%20%281%29.jpg,https://courses.analyticsvidhya.com/courses/machine-learning-summer-training,"This is the second step of the Machine Learning Summer Training, want to know more click here."
AI Ethics by Fractal,https://import.cdn.thinkific.com/118220/courses/1720521/9MuNm0LRmeWOiy5VjCDB_ai.png,https://courses.analyticsvidhya.com/courses/ai-ethics-fractal,"AI has a huge influence on our lives. From typing on our smartphones, to personalized recommendations on our favourite shopping websites, intelligent machines are everywhere. Our interactions with technology have become more personalized, but with humans ultimately behind these creations, the question is: where does the responsibility lie? Why and how should we begin the AI ethics conversation at Fractal?"
A Comprehensive Learning Path to Become a Data Engineer in 2022,https://import.cdn.thinkific.com/118220/courses/1667459/Rqbh8QTKShaGKJ6vNiRx_overview%20of%20data%20engineering.jpg,https://courses.analyticsvidhya.com/courses/a-comprehensive-learning-path-to-become-a-data-engineer-in-2022,Where do I begin? Data Engineering is such a huge field - where do you even start learning about Data Engineering?
Certified Business Analytics Program,https://files.cdn.thinkific.com/bundles/bundle_card_image_000/048/438/1719206987.original.png,https://courses.analyticsvidhya.com/bundles/certified-business-analytics-program,"With increase in data generated across the globe, the demand for Business Analytics professionals is rising continuously."
Certified Machine Learning Master's Program (MLMP),https://files.cdn.thinkific.com/bundles/bundle_card_image_000/046/940/1719206858.original.png,https://courses.analyticsvidhya.com/bundles/certified-machine-learning-master-s-program-mlmp,No description available
Certified Natural Language Processing Master’s Program,https://import.cdn.thinkific.com/118220/moBOBv3RMCKDgEoIi3DK_nlp%20master_thumb.jpg,https://courses.analyticsvidhya.com/bundles/certified-natural-language-processing-master-s-program,Natural Language Processing (NLP) is one of the fastest growing field within Artificial Intelligence. It enables machines to understand information contained in any text.
Certified Computer Vision Master's Program,https://import.cdn.thinkific.com/118220/BY3BuXPFRuaKZuKdYB5T_thumb_.jpg,https://courses.analyticsvidhya.com/bundles/certified-computer-vision-masters-program,"We have designed this certified program for Computer Vision enthusiasts like you who are looking for a place to start. Computer Vision is currently among the hottest fields in the industry. The demand for computer vision experts is outstripping the supply! So you’ve picked the perfect time to get into this field. This comprehensive program powers you to become a computer vision expert. The beauty of this program is that it assumes no prior knowledge of concepts. We start from the ground up by learning the basics of Python, statistics, core machine learning algorithms & fundamentals of Deep Learning."
Applied Machine Learning - Beginner to Professional,https://files.cdn.thinkific.com/courses/course_card_image_000/739/8911589353707.original.jpg,https://courses.analyticsvidhya.com/courses/applied-machine-learning-beginner-to-professional,"Machine Learning is re-shaping and revolutionising the world and disrupting industries and job functions globally. It is no longer a buzzword - many different industries have already seen automation of business processes and disruptions from Machine Learning. In this age of machine learning, every aspiring data scientist is expected to upskill themselves in machine learning techniques & tools and apply them in real-world business problems."
Ace Data Science Interviews,https://import.cdn.thinkific.com/118220/eZzXQDJSgyLlxFiQ5rbu_data_science_interview.jpg,https://courses.analyticsvidhya.com/courses/ace-data-science-interviews,Are you trying to get into data science roles but getting rejected by employers? Are you scared of getting into data science interviews? Or don't know what to expect in data science interviews? This is just the course you need.
Writing Powerful Data Science Articles,https://import.cdn.thinkific.com/118220/courses/1292824/YfJD5SeRLaXRxYgVb2uw_icon.png,https://courses.analyticsvidhya.com/courses/writing-powerful-data-science-articles,"""Either write something worth reading or do something worth writing."" - Benjamin Franklin"
Machine Learning Certification Course for Beginners,https://import.cdn.thinkific.com/118220/NjFxaJVSFeAfMSHYoG9Q_Machine_Learning_for_Beginners_b896980a-b1d1-41bc-9bab-d8d3176daaf8.png,https://courses.analyticsvidhya.com/courses/Machine-Learning-Certification-Course-for-Beginners,Machine Learning is the science of teaching machines how to learn by themselves. Machine Learning is reshaping and revolutionizing the world and disrupting industries and job functions globally.
